id,Year,Title,Abstract
J2258,2021,Non-Invasive Prenatal Fetal Blood Group Genotype and Its Application in the Management of Hemolytic Disease of Fetus and Newborn: Systematic Review and Meta-Analysis,"Hemolytic disease of fetus and newborn (HDFN) imposes great healthcare burden being associated with maternal alloimmunization against parental-inherited fetal red blood cell antigens causing fetal anemia or death. Noninvasive prenatal analysis (NIPT) provides safe fetal RHD genotyping for early identification of risk pregnancies and proper management guidance. We aimed to conduct systematic review and meta-analysis on NIPT's beneficial application, in conjunction with quantitative maternal alloantibody analysis, for early diagnosis of pregnancies at risk. Search for relevant articles was done in; PubMed/Medline, Scopus, and Ovid (January 2006-April 2020), including only English-written articles reporting reference tests and accuracy data. Nineteen eligible studies were critically appraised. NIPT was estimated highly sensitive/specific for fetal RHD genotyping beyond 11-week gestation. Amplifications from >=2 exons are optimum to increase accuracy. NIPT permits cost-effectiveness, precious resources sparing, and low emotional stress. Knowledge of parental ethnicity is important for correct NIPT result interpretations and quantitative screening. Cut-off titer >=8-up-to-32 is relevant for anti-D alloantibodies, while, lower titer is for anti-K. Alloimmunization is influenced by maternal RHD status, gravida status, and history of adverse obstetrics. In conclusion, NIPT allows evidence-based provision of routine anti-D immunoprophylaxis and estimates potential fetal risks for guiding further interventions. Future large-scale studies investigating NIPT's non-RHD genotyping within different ethnic groups and in presence of clinically significant alloantibodies are needed. Copyright © 2021 Elsevier Inc."
J3155,2022,Tocilizumab for giant cell arteritis,"- Background Giant cell arteritis (GCA) is the most common form of systemic vasculitis in people older than 50 years of age. It causes granulomatous inflammation of medium‐ to large‐sized vessels. Tocilizumab is a recombinant monoclonal antibody directed against interleukin‐6 receptors (IL‐6R). Objectives To assess the effectiveness and safety of tocilizumab, given alone or with corticosteroids, compared with therapy without tocilizumab for treatment of GCA. Search methods We searched the Cochrane Central Register of Controlled Trials (CENTRAL) (which contains the Cochrane Eyes and Vision Trials Register) (2020, Issue 1); Ovid MEDLINE; Embase.com; PubMed; Latin American and Caribbean Health Science Information database (LILACS); ClinicalTrials.gov; and the World Health Organization (WHO) International Clinical Trials Registry Platform (ICTRP). There were no date or language restrictions in the electronic search for trials. We last searched the electronic databases on 3 January 2020. Selection criteria We included only randomized controlled trials (RCTs) that compared tocilizumab of any dosage regimen (alone or with corticosteroids) with therapy without tocilizumab that had a minimum follow‐up of six months. Participants were at least 50 years of age, with biopsy‐proven GCA or by large‐vessel vasculitis by angiography, and met the American College of Rheumatology 1990 guidelines for GCA. Data collection and analysis We used standard Cochrane methodology. Main results Main results We included two RCTs in the review. The studies were conducted in the USA, Canada, and Europe and enrolled a total of 281 participants with GCA, of whom 74% were women. The mean age of participants was 70 years, with new‐onset or relapsing GCA, and fulfilled the 1990 American College of Rheumatology criteria with no uncontrolled comorbidities. Both studies were funded by F. Hoffmann‐La Roche AG, the manufacturer of tocilizumab. Findings One RCT (30 participants) compared tocilizumab administered every four weeks versus placebo. Point estimates at 12 months and beyond favored tocilizumab over placebo in terms of sustained remission (risk ratio (RR) 4.25, 95% confidence interval (CI) 1.21 to 14.88; moderate‐certainty evidence). Point estimates suggest no evidence of a difference for all‐cause mortality at 12 months or more (RR 0.17, 95% CI 0.01 to 3.94; moderate‐certainty evidence). At 12 months, mean time to first relapse after induction of remission was 25 weeks in favor of participants receiving tocilizumab compared to placebo (mean difference (MD) 25, 95% CI 11.4 to 38.6; moderate‐certainty evidence). The second RCT (250 participants) randomized participants into two intervention and two comparator groups to receive tocilizumab weekly (100 participants), bi‐weekly (49 participants), weekly placebo + 26‐week taper (50 participants), or weekly placebo + 52‐week taper (51 participants). At 12 months, point estimates from this study on proportion of participants with sustained remission favored participants who received tocilizumab weekly versus placebo + 52‐week taper (RR 3.17, 95% CI 1.71 to 5.89; 151 participants); tocilizumab weekly versus placebo + 26‐week taper (RR 4.00, 95% CI 1.97 to 8.12; 150 participants); tocilizumab every other week versus placebo + 52‐week taper (RR 3.01, 95% CI 1.57 to 5.75; 100 participants); tocilizumab every other week versus placebo + 26‐week taper (RR 3.79, 95% CI 1.82 to 7.91; 99 participants) (moderate‐certainty evidence). Point estimates on proportion of participants who did not need escape therapy (defined by the study as the inability to keep to the protocol‐defined prednisone taper) favored participants who received tocilizumab weekly versus placebo + 52‐week taper (RR 1.71, 95% CI 1.24 to 2.35; 151 participants); tocilizumab weekly versus placebo + 26‐week taper (RR 2.96, 95% CI 1.83 to 4.78; 150 participants); tocilizumab every other week versus placebo + 52‐week taper (RR 1.49, 95% CI 1.04 to 2.14; 100 participants) but not tocilizumab eve y other week versus placebo + 26‐week taper (RR 0.65, 95% CI 0.27 to 1.54; 99 participants) (moderate‐certainty evidence). This study did not report mean time to first relapse after induction of remission or all‐cause mortality. Across comparison groups, the same study found no evidence of a difference in vision changes and inconsistent evidence with regard to quality of life. Evidence on quality of life as assessed by the physical (MD 8.17, 95% CI 4.44 to 11.90) and mental (MD 5.61, 95% CI 0.06 to 11.16) component score of the 36‐Item Short Form Health Survey (SF‐36) favored weekly tocilizumab versus placebo + 52‐week taper but not bi‐weekly tocillizumab versus placebo + 26‐week taper (moderate‐certainty evidence). Adverse events One RCT reported a lower percentage of participants who experienced serious adverse events when receiving tocilizumab every four weeks versus placebo. The second RCT reported no evidence of a difference among groups with regard to adverse events; however, fewer participants reported serious adverse events in the tocilizumab weekly and tocilizumab biweekly interventions compared with the placebo + 26‐week taper and placebo + 52‐week taper comparators. Investigators in both studies reported that infection was the most frequently reported adverse event. Authors' conclusions This review indicates that tocilizumab therapy may be beneficial in terms of proportion of participants with sustained remission, relapse‐free survival, and the need for escape therapy. While the evidence was of moderate certainty, only two studies were included in the review, suggesting that further research is required to corroborate these findings. Future trials should address issues related to the required duration of therapy, patient‐reported outcomes such as quality of life and economic outcomes, as well as the clinical outcomes evaluated in this review. Plain language summary What are the benefits and risks of tocilizumab (a medicine that reduces inflammation) for treating giant cell arteritis (a disease of the blood vessels)? Key messages  · People with giant cell arteritis who have an injection of tocilizumab every week or two weeks have an improved chance of being symptom‐free after a year. People treated with tocilizumab every four weeks probably have an improved chance of being symptom‐free after a year. · Tocilizumab probably causes similar numbers of adverse (unwanted) effects to a placebo (dummy treatment). · More studies are needed to strengthen the body of evidence and investigate whether duration of treatment affects the success of tocilizumab. What is giant cell arteritis?  Giant cell arteritis (GCA) is an inflammation (swelling) of the vessels that carry blood from the heart to the rest of the body (arteries). It usually affects people aged over 50 and can cause: · vision problems (such as double vision or vision loss in one or both eye(s)); · jaw pain while eating or talking; · pain and tenderness over the temples (sides of the head); · frequent and severe headaches; and · weight loss. If untreated, GCA can cause permanent loss of vision or a stroke. How is GCA treated?  GCA is usually treated with anti‐inflammation medicines called steroids. People typically need to take steroids for several years, which can cause adverse effects such as diabetes, osteoporosis (bone loss), hypertension (raised blood pressure), and infection. A possible alternative treatment is an injectable medicine called tocilizumab, which aims to stop the body’s defense system (immune system) from mistakenly attacking its healthy tissues and causing inflammation. What did we want to find out?  We wanted to compare the benefits and risks of tocilizumab against those of other treatments for GCA. What did we do?  We searched for studies that compared tocilizumab against other treatments for GCA. We compared and summarized the results of these studies and rated our confidence in the evidence, based on factors such as study methods and sizes of participant groups. What did we find?  We ound two studies, conducted in the USA, Canada, and Europe, involving a total of 281 people with GCA. Everyone taking part in the study was aged over 50 (average age: 70), and 74% were women. Tocilizumab was given every four weeks in one study (30 people) and every week or every two weeks in the other study (251 people). Both studies lasted one year, and compared tocilizumab against a placebo. Both studies were funded by the manufacturer of tocilizumab. Tocilizumab given every four weeks compared to placebo The evidence suggests that after a year of treatment, compared to placebo, tocilizumab given every four weeks probably: · improves the chances of successful GCA treatment (absence of symptoms); · delays the return of GCA; and · reduces the need to use steroids to treat GCA. Tocilizumab given every one or two weeks compared to placebo Tocilizumab given either every week or every two weeks for a year: · improves the chances of successful GCA treatment; · probably improves the chances of not needing escape therapy; · probably improves physical and mental quality of life (well‐being); but · probably makes little or no difference to changes in vision. Adverse effects The most common adverse effect experienced by people taking part in the study was infection. The evidence suggests that tocilizumab probably decreases the number of serious adverse effects compared to placebo. What are the limitations of the evidence?  The evidence is only based on two studies, which limits our confidence in the findings. How up‐to‐date is the evidence?  The evidence is current to January 2020."
J4033,2023,Ataluren and similar compounds (specific therapies for premature termination codon class I mutations) for cystic fibrosis,"- Background Cystic fibrosis (CF) is a common, life‐shortening, genetic disorder in populations of Northern European descent caused by the mutation of a single gene that codes for the production of the cystic fibrosis transmembrane conductance regulator (CFTR) protein. This protein coordinates the transport of salt (and bicarbonate) across cell surfaces, and the mutation most notably affects the airways. In the lungs of people with CF, the defective protein compromises mucociliary clearance and makes the airway prone to chronic infection and inflammation, damaging the structure of the airways and eventually leading to respiratory failure. In addition, abnormalities in the truncated CFTR protein lead to other systemic complications, including malnutrition, diabetes and subfertility. Five classes of mutation have been described, depending on the impact of the mutation on the processing of the CFTR protein in the cell. In class I mutations, premature termination codons prevent the production of any functional protein, resulting in severe CF. Therapies targeting class I mutations aim to enable the normal cellular mechanism to read through the mutation, potentially restoring the production of the CFTR protein. This could, in turn, normalise salt transport in the cells and decrease the chronic infection and inflammation that characterises lung disease in people with CF. This is an update of a previously published review. Objectives To evaluate the benefits and harms of ataluren and similar compounds on clinically important outcomes in people with CF with class I mutations (premature termination codons). Search methods We searched the Cochrane Cystic Fibrosis Trials Register, which is compiled from electronic database searches and handsearching of journals and conference abstract books. We also searched the reference lists of relevant articles. The last search of the Cochrane Cystic Fibrosis Trials Register was conducted on 7 March 2022. We searched clinical trial registries maintained by the European Medicines Agency, the US National Institutes of Health and the World Health Organization. The last search of the clinical trials registries was conducted on 4 October 2022. Selection criteria Randomised controlled trials (RCTs) of parallel design comparing ataluren and similar compounds (specific therapies for class I mutations) with placebo in people with CF who have at least one class I mutation. Data collection and analysis For the included trials, the review authors independently extracted data, assessed the risk of bias and evaluated the certainty of the evidence using GRADE; trial authors were contacted for additional data. Main results Our searches identified 56 references to 20 trials; of these, 18 trials were excluded. Both the included parallel RCTs compared ataluren to placebo for 48 weeks in 517 participants (males and females; age range six to 53 years) with CF who had at least one nonsense mutation (a type of class I mutation). The certainty of evidence and risk of bias assessments for the trials were moderate overall. Random sequence generation, allocation concealment and blinding of trial personnel were well documented; participant blinding was less clear. Some participant data were excluded from the analysis in one trial that also had a high risk of bias for selective outcome reporting. PTC Therapeutics Incorporated sponsored both trials with grant support from the Cystic Fibrosis Foundation, the US Food and Drug Administration's Office of Orphan Products Development and the National Institutes of Health. The trials reported no difference between treatment groups in terms of quality of life, and no improvement in respiratory function measures. Ataluren was associated with a higher rate of episodes of renal impairment (risk ratio 12.81, 95% confidence interval 2.46 to 66.65; P = 0.002; I 2 = 0%; 2 trials, 517 participants). The trials reported no treatment effect for ataluren for the review's secondary outcomes of pulmonary exacerbation, computed tomography score, weight, body mass index and swea chloride. No deaths were reported in the trials. The earlier trial performed a post hoc subgroup analysis of participants not receiving concomitant chronic inhaled tobramycin (n = 146). This analysis demonstrated favourable results for ataluren (n = 72) for the relative change in forced expiratory volume in one second (FEV 1 ) per cent (%) predicted and pulmonary exacerbation rate. The later trial aimed to prospectively assess the efficacy of ataluren in participants not concomitantly receiving inhaled aminoglycosides, and found no difference between ataluren and placebo in FEV 1 % predicted and pulmonary exacerbation rate. Authors' conclusions There is currently insufficient evidence to determine the effect of ataluren as a therapy for people with CF with class I mutations. One trial reported favourable results for ataluren in a post hoc subgroup analysis of participants not receiving chronic inhaled aminoglycosides, but these were not reproduced in the later trial, suggesting that the earlier results may have occurred by chance. Future trials should carefully assess for adverse events, notably renal impairment, and consider the possibility of drug interactions. Cross‐over trials should be avoided, given the potential for the treatment to change the natural history of CF. Plain language summary Ataluren and similar compounds (specific therapies for premature termination codon class I mutations) for cystic fibrosis Review question Can ataluren (and similar compounds specifically targeting class I mutations in cystic fibrosis (CF)) improve the quality of life and lung function of people with CF without having adverse effects? Key messages What is CF? In people with CF, the gene encoding a protein called the cystic fibrosis transmembrane conductance regulator (CFTR) is faulty. This especially affects the airways, causing the airway surface to dry out and making it difficult to clear thick mucus. This leads to progressive infection and damages the lungs, shortening life expectancy. How will ataluren treat CF? In people with certain CF genetic mutations where the genetic instructions for producing the CFTR protein are interrupted (known as premature termination codon or class I mutations), ataluren (and similar medicines) may be able to skip over the break in the faulty gene sequence and allow the body to produce a corrected version of the CFTR protein. By correcting the protein, the airway surface should remain hydrated, allowing people with CF to better clear their mucus and so develop fewer lung infections. What did we want to find out? We wanted to know whether ataluren can improve the quality of life and lung function of people with CF, and whether it can do so without any side effects. We also wanted to measure the effects on lung infections (need for hospital visits or additional antibiotics), survival, nutritional status (weight, body mass index and height) and whether treatment was cost‐effective. What did we do? We searched for trials that directly compared drugs such as ataluren to placebo (treatment not containing an active drug) or to a different treatment for these specific genetic mutations in any people with CF. What did we find? We found two trials including 517 people (males and females between 6 and 53 years of age) comparing ataluren to a placebo. The trials lasted 48 weeks and everyone taking part in the trials had at least one gene with a class I mutation. Key results In people taking ataluren, there was no improvement in clinical outcomes such as quality of life, lung function, exacerbations (flare up of disease), sweat chloride (salt) levels or weight compared with people taking placebo. The trials found that kidney damage was more common in people taking ataluren. The earlier trial analysed their results in a way not originally planned to see whether the effects of ataluren and placebo were different in people using inhaled tobramycin (an antibiotic) on a long‐term basis compared with people not taking the inhaled antibiotic. In people taking ataluren but not using inhaled tobramycin, lung function declined at a slower rate and there were fewer exacerbations than in people in the placebo group also not using inhaled tobramycin. The later trial specifically recruited people not taking tobramycin to see whether this really was an effect of the antibiotic, but the investigators did not find any difference between the ataluren and placebo groups for changes in lung function or exacerbations. This suggests that the earlier results occurred by chance. There were no deaths and we did not find any differences between ataluren and placebo in side effects or nutritional status. Neither trial reported on hospitalisations, extra courses of antibiotics or cost‐effectiveness. We have not found enough high‐quality evidence to determine the effect of ataluren for treating CF. We recommend that future trials are designed and reported clearly so that their results can be included in a systematic review. What are the limitations of the evidence? We are moderately confident in our findings, but there is some uncertainty due to how widely the results varied between participants. We are satisfied that everyone taking part had an equal chance of being in either group (ataluren or placebo) and that no one could work out which group the next person would be put into (so that healthier people did not receive the treatment and make the results seem better). We believe that the clinicians running the trials and those taking part in the trials did not know which treatment each person was receiving. We have some concerns about the emphasis the investigators of one trial placed on the results of a comparison they had not planned (the use of long‐term inhaled tobramycin). Unfortunately, that trial did not report all its results clearly. Sometimes, the results were reported in a way that meant they could not be used in this review, and sometimes the information was not reported at all. This affected our confidence in the overall results. Trial funding sources Both trials were sponsored by PTC Therapeutics Incorporated, who make ataluren. The Cystic Fibrosis Foundation, the US Food and Drug Administration's Office of Orphan Products Development and the US National Institutes of Health also supported the trials. How up to date is this evidence? We last searched for evidence on 4 October 2022."
J3232,2022,Cost-Effectiveness of Open-Group Behavioral Weight Management Programs: RCT With 5 Year Outcomes,"Background: Open-group behavioral weight management programs are effective in the short term but longer term outcomes are unclear. We conducted the first randomized controlled trial to evaluate the 5-year effectiveness and cost-effectiveness of a commercial opengroup intervention versus standard care. Method(s): We randomized 1267 adults from English primary care practices with BMI>=28kg/m<sup>2</sup> to either a brief intervention, 12-week behavioral program, or 52-week behavioral program in a 2:5:5 allocation. We followed them up 5 years later. We estimated adjusted differences in 5-year weight change between randomized groups using ANCOVA, assessed within-trial cost-effectiveness, and modeled long-term cost-effectiveness. This study is registered: ISRCTN64986150. Result(s): We ascertained weight for 871 (69%) participants. Mean (SD) weight change from baseline to 5 years was -0.46kg (8.31) in the brief intervention group, -1.95kg (9.55) in the 12-week program group, and -2.67kg (9.81) in the 52-week program. The adjusted difference (95%CI) was -1.76kg (-3.68, 0.17) between the 52-week program and the brief intervention; -0.96 kg (-2.90, 0.97) between the 12-week program and the brief intervention; and -0.80kg (-2.13, 0.54) between the 52-week and the 12-week program. There was no evidence of any differences between groups in fat mass, glycated hemoglobin, lipid profile and blood pressure. During the study, the 12-week program incurred the lowest cost and produced the highest Quality Adjusted Life Years (QALY). Modeling of clinical events beyond 5 years, suggested the 52-week program would deliver the highest QALYs at the lowest cost. Conclusion(s): Whilst 5-year differences in weight were not conclusive, they counter the common belief that all weight lost is quickly regained. Although there was no evidence within the trial that cardiovascular risk factors improved, long-term modeling suggests that commercial open-group behavioral programs are likely to reduce the incidence of weight-related disease and may be cost-saving."
