id,Year,Title,Abstract
J5341,2024,"Real-World Evaluation of the Feasibility, Acceptability and Safety of a Remote, Self-Management Parkinson's Disease Care Pathway: A Healthcare Improvement Initiative","Background: There is significant unmet need for effective and efficiently delivered care for people with Parkinson's disease (PwP). We undertook a service improvement initiative to co-develop and implement a new care pathway, Home Based Care (HBC), based on supported self-management, remote monitoring and the ability to trigger a healthcare contact when needed. Objective(s): To evaluate feasibility, acceptability and safety of Home Based Care. Method(s): We evaluated data from the first 100 patients on HBC for 6 months. Patient monitoring, performed at baseline and 6-monthly, comprised motor (MDS-UPDRS II and accelerometer), non-motor (NMSQ, PDSS-2, HADS) and quality of life (PDQ) measures. Care quality was audited against Parkinson's UK national audit standards. Process measures captured feasibility. Acceptability was assessed using a mixed-methods approach comprising questionnaires and semi-structured interviews. Result(s): Between October 2019 and January 2021, 108 PwP were enrolled onto HBC, with data from 100 being available at 6 months. Over 90% of all questionnaires were returned, 97% were complete or had < 3 missing items. Reporting and communications occurred within agreed timeframes. Compared with baseline, after 6m on HBC, PD symptoms were stable; more PwP felt listened to (90% vs. 79%) and able to seek help (79% vs. 68%). HBC met 93% of national audit criteria. Key themes from the interviews included autonomy and empowerment. Conclusion(s): We have demonstrated acceptability, feasibility and safety of our novel remotely delivered Parkinson's care pathway. Ensuring scalability will widen its reach and realize its benefits for underserved communities, enabling formal comparisons with standard care and cost-effectiveness evaluation. Copyright © 2024 - The authors. Published by IOS Press."
J859,2019,Lower carbohydrate diets in type 2 diabetes/pre-diabetes and metabolic improvements in a UK primary care service,"Background and aims: Diabetes is a common metabolic disease which poses a massive health and financial burden, with a total spend on diabetes prescribing of 316 per patient in 2017/18 (UK) according to Public Health England's Diabetes Outcomes Versus Expenditure (DOVE) Tool. We present data from a retrospective analysis of a low-carbohydrate diet intervention conducted in Type 2 diabetic (T2DM) and pre-diabetic patients, in a primary care service in the North West of England. Material(s) and Method(s): The intervention involved patient-based goal setting and explanations of the glycaemic consequences of sugary and starchy carbohydrates, incorporated into 10-minute primary care consultations and group work. Standard metabolic outcomes in diabetic and pre-diabetic patients, before and after the dietary modification, were analysed. The patients included 122 diabetics (80 men, 42 women) and 67 Pre-diabetics (35 men, 32 women). The metabolic parameters were measured using standard procedures and included body weight, Body Mass Index (BMI), HbA1C, systolic (SBP) and diastolic (DBP) blood pressure, Total Cholesterol, Serum Triglycerides, Serum High Density Lipoprotein (HDL) and Triglyceride/HDL ratio. Descriptive statistics were calculated and presented as median and interquartile range (IQR). Median (IQR) duration of the intervention was 20 months (7,31) for the diabetic and 19 (9, 30) months for the prediabetic patients. Result(s):We observed improvements in all the aforementioned metabolic parameters for diabetic and pre-diabetic patients. Table 1 shows metabolic outcomes at baseline and their change after the intervention presented as median and interquartile range (IQR). The greatest reduction was observed for weight (pre-diabetics: 6.7 kg (4.5, 10.9) and diabetics: 7 kg (4.5, 12)) and HbA1C (pre-diabetics: 5.0 mmol/mol (3, 6) and diabetics: 16 mmol/mol (9, 31)). Conclusion(s): This study emphasises early prevention through nonpharmacological approaches in the management of T2DM/Pre-Diabetes focusing on a simple, adaptable and scalable lower-carbohydrate dietary intervention in the primary care setting. Our results demonstrate an improvement in all typically measured cardio-metabolic factors with the greatest benefits to weight and HbA1C. Given its low cost, this intervention has potential implications on healthcare cost savings if trialled for potential implementation at scale."
J5368,2024,Standard‐ versus extended‐duration anticoagulation for primary venous thromboembolism prophylaxis in acutely ill medical patients,"- Background Venous thromboembolism (VTE) includes two interrelated conditions, deep vein thrombosis (DVT) and pulmonary embolism (PE). Risk factors include dehydration, prolonged immobilization, acute medical illness, trauma, clotting disorders, previous thrombosis, varicose veins with superficial vein thrombosis, exogenous hormones, malignancy, chemotherapy, infection, inflammation, pregnancy, obesity, smoking, and advancing age. It is estimated that hospitalized patients are 100 times more likely to develop VTE and, compared with surgical patients, medical patients often have more severe forms of VTE. VTE carries a significant risk of morbidity and mortality. Prophylactic strategies, including mechanical and pharmacological methods, are recommended for patients at risk of VTE. Pharmacological prophylaxis is considered the standard practice for acutely ill medical patients at risk of developing VTE in the absence of contraindications. For hospitalized patients, the risk of VTE extends beyond hospital stay and up to 90 days, with most events occurring within 45 days of discharge. Despite that, it remains unclear whether extended‐duration anticoagulation for primary VTE prophylaxis would provide benefits without added risks or harm. Objectives To assess the benefits and risks of standard‐ versus extended‐duration anticoagulation for primary VTE prophylaxis in acutely ill medical patients. Search methods The Cochrane Vascular Information Specialist searched the Cochrane Vascular Specialized Register, CENTRAL, MEDLINE, Embase, CINAHL and Web of Science databases, as well as the World Health Organization International Clinical Trials Registry Platform and ClinicalTrials.gov trials registers up to 27 March 2023. We also searched reference lists of all included studies for additional references and searched the last five years of the American Society of Hematology conference proceedings. Selection criteria We included randomized controlled trials (RCTs) comparing standard‐duration versus extended‐duration anticoagulation for primary VTE prophylaxis in acutely ill medical patients (adults being treated in a medical inpatient setting). Data collection and analysis We used the standard methodological procedures set by Cochrane. At least two authors independently screened titles and abstracts for inclusion and performed data extraction. Two authors independently assessed the risk of bias (RoB) using the Cochrane RoB 2 tool. We analyzed outcomes data using the risk ratio (RR) with 95% confidence intervals (CIs). We used the GRADE approach to assess the certainty of evidence for each outcome. Our outcomes of interest were assessed in the short term (during the treatment period and within 45 days of hospitalization) and long term (assessed beyond 45 days of hospitalization). Primary outcomes were symptomatic VTE, major bleeding, and all‐cause mortality. Secondary outcomes were total VTE, a composite of fatal and irreversible vascular events (including myocardial infarction, non‐fatal PE, cardiopulmonary death, stroke), fatal bleeding, and VTE‐related mortality. Main results A total of seven RCTs fulfilled our inclusion criteria, comprising 40,846 participants. All studies contributing data to our outcomes were at low risk of bias in all domains. Most studies reported the outcomes in the short term. Extended‐duration anticoagulation, compared with standard‐duration anticoagulation, for primary VTE prophylaxis in acutely ill medical patients reduced the risk of short‐term symptomatic VTE (RR 0.60, 95% CI 0.46 to 0.78; standard‐duration 12 per 1000, extended‐duration 7 per 1000, 95% CI 6 to 10; number needed to treat for an additional beneficial outcome [NNTB] 204, 95% CI 136 to 409; 4 studies, 24,773 participants; high‐certainty evidence). This benefit, however, was offset by an increased risk of short‐term major bleeding (RR 2.05, 95% CI 1.51 to 2.79; standard‐duration 3 per 1000, extended duration 6 per 1000, 95% CI 5 to 8; number needed to treat for an additional harmful outcome [NNTH 314, 95% CI 538 to 222; 7 studies, 40,374 participants; high‐certainty evidence). Extended‐duration anticoagulation, compared with standard‐duration, results in little to no difference in short‐term all‐cause mortality (RR 0.97, 95% CI 0.87 to 1.08; standard‐duration 34 per 1000, extended‐duration 33 per 1000, 95% CI 30 to 37; 5 studies, 38,080 participants; high‐certainty evidence), reduced short‐term total VTE (RR 0.75, 95% CI 0.67 to 0.85; standard‐duration 37 per 1000, extended duration 28 per 1000, 95% CI 25 to 32; NNTB 107, 95% CI 76 to 178; 5 studies, 33,819 participants; high‐certainty evidence), and short‐term composite of fatal and irreversible vascular events (RR 0.71, 95% CI 0.56 to 0.91; standard‐duration 41 per 1000, extended‐duration 29 per 1000, 95% CI 23 to 37; NNTB 85, 95% CI 50 to 288; 1 study, 7513 participants; high‐certainty evidence). Extended‐duration anticoagulation may result in little to no difference in short‐term fatal bleeding (RR 2.28, 95% CI 0.84 to 6.22; standard‐duration 0 per 1000, extended‐duration 0 per 1000, 95% CI 0 to 1; 7 studies, 40,374 participants; low‐certainty evidence), and likely results in little to no difference in short‐term VTE‐related mortality (RR 0.78, 95% CI 0.58 to 1.05; standard‐duration 5 per 1000, extended‐duration 4 per 1000 95% CI 3 to 6; 6 studies, 36,170 participants; moderate‐certainty evidence). Authors' conclusions In the short term, extended‐ versus standard‐duration anticoagulation for primary VTE prophylaxis in acutely ill medical patients reduced the risk of symptomatic VTE at the expense of an increased risk of major bleeding. Extended‐duration anticoagulation resulted in little to no difference in all‐cause mortality. Extended‐duration anticoagulation reduced the risk of total VTE and the composite of fatal and irreversible vascular events, but may show little to no difference in fatal bleeding and VTE‐related mortality. Further data, with longer follow‐up, are needed to determine the optimal agent and duration for primary VTE prophylaxis in acutely ill medical patients. Plain language summary Does a strategy of extended‐duration blood thinners for preventing the development of blood clots in the legs and lungs improve the outcomes of patients admitted to the hospital for an acute medical illness? Key message Extending blood thinners beyond the hospital stay (after discharge) decreased the probability of developing blood thrombi (blood clots) in the legs and emboli (blood clots) in the lungs at the expense of an increased risk of major bleeding. What is venous thromboembolism (VTE)? Venous thrombosis is when a blood thrombus (blood clot) is formed in a vein. This can cause symptoms such as pain and swelling due to obstruction of the blood flow. It most commonly occurs in the deep veins of the legs, commonly referred to as deep venous thrombosis (DVT). In some instances, the blood thrombi can dislodge, forming an embolus (blood clot that has migrated) that travels through the venous system to another part of the body, most commonly the lungs. This condition is called pulmonary embolism (PE), which can sometimes be fatal. Venous thromboembolism (VTE) is a term used to describe both DVT and PE. Hospitalization due to medical illness is amongst the predisposing factors for VTE. This is likely due to a variety of risk factors, including underlying medical problems, new illness, decreased mobility and possibly medications, which is why prevention is crucial in these patient populations. How is VTE prevented in acutely ill hospitalized patients? Patients who are hospitalized due to medical illness and who are at high risk of developing VTE can undergo prevention strategies. Unless there is a reason not to do so, patients usually receive blood thinners to decrease the risk of VTE. Usually, blood thinners are administered throughout hospitalization. It has been proposed that extending blood thinners after hospital discharge might have beneficial effects and could better prevent VTE. What did e want to find out? We wanted to find out whether extending the administration of blood thinners beyond the hospital stay would lower the risk of developing VTE and its associated dangers compared to its administration only during the hospital stay. We also sought to explore the unwanted effects related to extending the duration of blood thinners. What did we do? We searched for studies that investigated extending blood thinners beyond the hospital stay in acutely ill medical patients and compared them to blood thinners only during hospitalization. We then summarised the results of these studies and rated our confidence in the evidence based on factors such as the respective study sizes and research methods. What did we find? Our search yielded seven clinical trials, including 40,846 participants that addressed our review question. Most studies reported the outcomes in the short term (i.e. during the treatment period and within 45 days of hospitalization). Extended‐duration blood thinners, compared with standard‐duration blood thinners, reduced the risk of short‐term symptomatic VTE (i.e. VTE that manifests because of patient‐reported symptoms). However, that benefit was counteracted by an increased risk of short‐term major bleeding (e.g. requiring blood transfusion and/or associated with a severe drop in haemoglobin). There was little to no difference between either strategy in terms of death from any cause. Extended‐duration blood thinners, compared with standard‐duration blood thinners, resulted in a reduction of short‐term total VTE (including those manifesting with and without symptoms, only discovered via routine testing/screening) and the composite outcome of fatal and irreversible vascular events (including non‐fatal heart attack, non‐fatal PE, death due to heart/lung causes, or stroke). However, there is likely little to no difference between either strategy in terms of fatal bleeding (significant bleeding resulting in death) or death due to VTE. What are the limitations of the evidence? When assessing for fatal bleeding and death related to VTE, the results from the studies varied widely. How up to date is this evidence? The evidence is up to date to March 2023."
J871,2019,Transcatheter aortic valve implantation versus surgical aortic valve replacement for severe aortic stenosis in people with low surgical risk,"- Background Severe aortic valve stenosis (AS) is a major cause of morbidity and mortality worldwide. The definitive management for severe AS is aortic valve replacement (AVR). The choice of transcatheter approach versus open‐heart surgery for AVR in people with severe AS and low surgical risk remains a matter of debate. Objectives To assess the benefits and harms of transcatheter aortic valve implantation (TAVI) compared to surgical aortic valve replacement (SAVR) in people with severe AS and low surgical risk. Search methods We searched the following databases for randomised controlled trials (RCTs) on 29 April 2019: Cochrane Central Register of Controlled Trials (CENTRAL), MEDLINE, Embase, and Web of Science Core Collection. We also searched ClinicalTrials.gov and the World Health Organization International Clinical Trials Registry Platform. We searched all databases from inception to present and imposed no restriction on language or date of publication. Selection criteria We included RCTs that compared TAVI and SAVR in adults (18 years of age or older) with severe AS and low surgical risk. Data collection and analysis We used the standard methodological procedures expected by Cochrane. Two authors independently screened titles and abstracts for inclusion, performed data extraction, and assessed risk of bias in the studies included. We analysed dichotomous data using the risk ratio (RR) and continuous data using the mean difference (MD), with respective 95% confidence intervals (CI). We assessed the certainty of evidence for each outcome using the GRADE approach. Our outcomes of interest were assessed in the short term (i.e. during hospitalisation and up to 30 days of follow‐up). Primary outcomes were all‐cause mortality, stroke, and rehospitalisation. Secondary outcomes were myocardial infarction (MI), cardiac death, length of hospital stay (LOS), permanent pacemaker (PPM) implantation, new‐onset atrial fibrillation, acute kidney injury (AKI), and any bleeding. Main results We identified four studies (13 reports), with 2818 participants, and one ongoing study. Overall certainty of evidence ranged from high to very low. There is probably little or no difference between TAVI and SAVR for the following short‐term outcomes: all‐cause mortality (RR 0.69, 95% CI 0.33 to 1.44; SAVR 11 deaths per 1000, TAVI 8 deaths per 1000 (95% CI 4 to 16); 2818 participants; 4 studies; moderate‐certainty evidence); stroke (RR 0.73, 95% CI 0.42 to 1.25; SAVR 21 strokes per 1000, TAVI 16 strokes per 1000 (95% CI 9 to 27); 2818 participants; 4 studies; moderate‐certainty evidence); MI (RR 0.82, 95% CI 0.42 to 1.58; SAVR 14 MI per 1000, TAVI 11 MI per 1000 (95% CI 6 to 21); 2748 participants; 3 studies; moderate‐certainty evidence); and cardiac death (RR 0.71, 95% CI 0.32 to 1.56; SAVR 10 cardiac deaths per 1000, TAVI 7 cardiac deaths per 1000 (95% CI 3 to 16); 2818 participants; 4 studies; moderate‐certainty evidence). TAVI may reduce the risk of short‐term rehospitalisation, although the confidence interval also includes the possibility of no difference in risk between groups (RR 0.64, 95% CI 0.39 to 1.06; SAVR 30 cases per 1000, TAVI 19 cases per 1000 (95% CI 12 to 32); 2468 participants; 2 studies; low‐certainty evidence). TAVI, compared with SAVR, probably increases the risk of PPM implantation (RR 3.65, 95% CI 1.50 to 8.87; SAVR 47 per 1000, TAVI 170 cases per 1000 (95% CI 70 to 413); number needed to treat for an additional harmful outcome (NNTH) = 7; 2683 participants; 3 studies; moderate‐certainty evidence). We are uncertain whether TAVI, compared with SAVR, affects the LOS in days, although it appears to be associated with shorter LOS. TAVI, compared with SAVR, reduces the risk of atrial fibrillation (RR 0.21, 95% CI 0.15 to 0.30; 2683 participants; 3 studies), AKI (RR 0.30, 95% CI 0.16 to 0.58; 2753 participants; 4 studies), and bleeding (RR 0.31, 95% CI 0.16 to 0.62; 2753 participants; 4 studies) (all high‐certainty evidence). Authors' conclusions Our meta‐analysis indicates that, in t e short term, TAVI probably has little or no mortality difference compared to SAVR for severe AS in individuals with low surgical risk. Similarly, there is probably little or no difference in risk of stroke, MI, and cardiac death between the two approaches. TAVI may reduce the risk of rehospitalisation, but we are uncertain about the effects on LOS. TAVI reduces the risk of atrial fibrillation, AKI, and bleeding. However, this benefit is offset by the increased risk of PPM implantation. Long‐term follow‐up data are needed to further assess and validate these outcomes, especially durability, in the low surgical risk population. Plain language summary Transcatheter aortic valve implantation versus surgical aortic valve replacement in people with severe aortic stenosis and low surgical risk Review question Does transcatheter approach, compared to open‐heart surgery, for aortic valve replacement improve outcomes in people with severe aortic stenosis and low surgical risk? Background Aortic stenosis (AS) is the narrowing of the exit of the left ventricle of the heart (where the aorta begins). It typically gets worse over time. Its severity can be divided into mild, moderate, severe, and very severe; and it is distinguishable by ultrasound scan of the heart and other clinical features. Once it has become severe, treatment primarily involves surgery to replace the valve. An alternative approach is to use transcatheter aortic valve implantation (TAVI). This approach improves outcomes in individuals who are inoperable or at a high to intermediate risk for surgery. However, it remains unclear if TAVI is beneficial to those who have severe AS and are at a low surgical risk. Search Date The evidence is current to April 2019. We searched the literature and found a total of 3092 citations that were potentially relevant. After reviewing each of these, we found 13 published articles describing four clinical trials that could help us answer our question. Study characteristics The four clinical trials included 2818 participants who were randomly allocated to undergo either TAVI or surgical aortic valve replacement (SAVR). The trials were multicentre and took place in Australia, Canada, France, Japan, the Netherlands, New Zealand, the USA, Denmark, and Sweden. Key Results Moderate‐certainty evidence from clinical trials shows that, in the short term (i.e. during hospitalisation and up to 30 days of follow‐up), there is probably little or no difference between TAVI compared with SAVR in risk of death due to any cause, stroke (insult to the brain), myocardial infarction (injury or death of heart muscle), or death due to cardiac causes (e.g. myocardial infarction or failure of the heart muscle pump). Low‐certainty evidence shows that TAVI may reduce the risk of rehospitalisation compared with SAVR. We are uncertain whether TAVI, compared with SAVR, affects the length of hospital stay, although it appears to be associated with shorter duration of hospitalisation. High‐certainty evidence shows that fewer people had atrial fibrillation (a type of irregular heart rhythm), acute kidney injury (insult to the kidney), and bleeding when they underwent TAVI, compared with SAVR. However, moderate‐certainty evidence shows that TAVI probably increases the risk of permanent pacemaker implantation (a device that is placed to artificially set the heart rhythm), compared with SAVR. Quality of the evidence We consider the overall quality of evidence to be moderate for most relevant outcomes (death, stroke, myocardial infarction, cardiac death, and risk of permanent pacemaker implantation), with the exception of rehospitalisation (low‐quality evidence) and length of hospital stay (very low quality evidence). The evidence for atrial fibrillation, acute kidney injury, and bleeding was of high quality."
