id,Year,Title,Abstract
J3578,2022,Antidepressants for hip and knee osteoarthritis,"- Background Although pain is common in osteoarthritis, most people fail to achieve adequate analgesia. Increasing acknowledgement of the contribution of pain sensitisation has resulted in the investigation of medications affecting pain processing with central effects. Antidepressants contribute to pain management in other conditions where pain sensitisation is present. Objectives To assess the benefits and harms of antidepressants for the treatment of symptomatic knee and hip osteoarthritis in adults. Search methods We used standard, extensive Cochrane search methods. The latest search was January 2021. Selection criteria We included randomised controlled trials of adults with osteoarthritis that compared use of antidepressants to placebo or alternative comparator. We included trials that focused on efficacy (pain and function), treatment‐related adverse effects and had documentation regarding discontinuation of participants. We excluded trials of less than six weeks of duration or had participants with concurrent mental health disorders. Data collection and analysis We used standard Cochrane methods. Major outcomes were pain; responder rate; physical function; quality of life; and proportion of participants who withdrew due to adverse events, experienced any adverse events or had serious adverse events. Minor outcomes were proportion meeting the OARSI (Osteoarthritis Research Society International) Response Criteria, radiographic joint structure changes and proportion of participants who dropped out of the study for any reason. We used GRADE to assess certainty of evidence. Main results Nine trials (2122 participants) met the inclusion criteria. Seven trials examined only knee osteoarthritis. Two also included participants with hip osteoarthritis. All trials compared antidepressants to placebo, with or without non‐steroidal anti‐inflammatory drugs. Trial sizes were 36 to 388 participants. Most participants were female, with mean ages of 54.5 to 65.9 years. Trial durations were 8 to 16 weeks. Six trials examined duloxetine. We combined data from nine trials in meta‐analyses for knee and hip osteoarthritis. One trial was at low risk of bias in all domains. Five trials were at risk of attrition and reporting bias. High‐certainty evidence found that antidepressants resulted in a clinically unimportant improvement in pain compared to placebo. Mean reduction in pain (0 to 10 scale, 0 = no pain) was 1.7 points with placebo and 2.3 points with antidepressants (mean difference (MD) −0.59, 95% confidence interval (CI) −0.88 to −0.31; 9 trials, 2122 participants). Clinical response was defined as achieving a 50% or greater reduction in 24‐hour mean pain. High‐certainty evidence demonstrated that 45% of participants receiving antidepressants had a clinical response compared to 28.6% receiving placebo (RR 1.55, 95% CI 1.32 to 1.82; 6 RCTs, 1904 participants). This corresponded to an absolute improvement in pain of 16% more responders with antidepressants (8.9% more to 26% more) and a number needed to treat for an additional beneficial effect (NNTB) of 6 (95% CI 4 to 11). High‐certainty evidence showed that the mean improvement in function (on 0 to 100 Western Ontario and McMaster Universities Arthritis Index, 0 = best function) was 10.51 points with placebo and 16.16 points with antidepressants (MD −5.65 points, 95% CI −7.08 to −4.23; 6 RCTs, 1909 participants). This demonstrates a small, clinically unimportant response. Moderate‐certainty evidence (downgraded for imprecision) showed that quality of life measured using the EuroQol 5‐Dimension scale (−0.11 to 1.0, 1.0 = perfect health) improved by 0.07 points with placebo and 0.11 points with antidepressants (MD 0.04, 95% CI 0.01 to 0.07; 3 RCTs, 815 participants). This is clinically unimportant. High‐certainty evidence showed that total adverse events increased in the antidepressant group (64%) compared to the placebo group (49%) (RR 1.27, 95% CI 1.15 to 1.41; 9 RCTs, 2102 participants). The number needed to treat for an additiona harmful outcome (NNTH) was 7 (95% CI 5 to 11). Low‐certainty evidence (downgraded twice for imprecision for very low numbers of events) found no evidence of a difference in serious adverse events between groups (RR 0.94, 95% CI 0.46 to 1.94; 9 RCTs, 2101 participants). The NNTH was 1000. Moderate‐certainty evidence (downgraded for imprecision) showed that 11% of participants receiving antidepressants withdrew from trials due to an adverse event compared to 5% receiving placebo (RR 2.15, 95% CI 1.56 to 2.97; 6 RCTs, 1977 participants). The NNTH was 17 (95% CI 10 to 35). Authors' conclusions There is high‐certainty evidence that use of antidepressants for knee osteoarthritis leads to a non‐clinically important improvement in mean pain and function. However, a small number of people will have a 50% or greater important improvement in pain and function. This finding was consistent across all trials. Pain in osteoarthritis may be due to a variety of causes that differ between individuals. It may be that the cause of pain that responds to this therapy is only present in a small number of people. There is moderate‐certainty evidence that antidepressants have a small positive effect on quality of life with heterogeneity between trials. High‐certainty evidence indicates antidepressants result in more adverse events and moderate‐certainty evidence indicates more withdrawal due to adverse events. There was little to no difference in serious adverse events (low‐certainty evidence due to low numbers of events). This suggests that if antidepressants were being considered, there needs to be careful patient selection to optimise clinical benefit given the known propensity for adverse events with antidepressant use. Future trials should include alternative antidepressant agents or phenotyping of pain in people with osteoarthritis, or both. Plain language summary Antidepressants for osteoarthritis Background Osteoarthritis is a disease of the joints characterised by reduced cartilage and narrowing of the space between the joints. It may result in pain, deformity and disability. Antidepressant medicines are thought to affect pain by modulating nerve pathways in the central nervous system. We aimed to evaluate the clinical benefits and harms of antidepressants for knee and hip osteoarthritis pain. Study characteristics This review is current to January 2021. We included nine clinical trials with 2122 participants comparing antidepressants to placebo (a dummy treatment) and non‐steroidal anti‐inflammatory medicines (which are widely used to relieve pain and reduce inflammation). More participants were female (70%) and the average age was 54.4 to 65.9 years. Seven trials examined only knee osteoarthritis. Two also included people with hip osteoarthritis. All trials compared antidepressants to placebo, with or without non‐steroidal anti‐inflammatory medicines. Key results Compared with a placebo, antidepressants resulted in a small benefit. Pain Pain reduced by 0.59 points more on a 0‐ to 10‐point scale with antidepressants compared to placebo. – The placebo group had a pain reduction of 1.73 points. – The antidepressant group had a pain reduction of 2.32 points. Response A clinical response is considered a 50% or greater reduction in pain. About 16% more people taking an antidepressant had a reduction compared to placebo (that is, one in six people). – 28.65% of people taking placebo had a clinical response. – 45.2% of people taking antidepressants had a clinical response. Function Physical function is measured using walking, stair climbing and domestic duties. It improved 6% more with antidepressants compared to placebo. With antidepressants, the function score reduced by 5.65 on a 0‐ to 100‐point scale (lower score = better function), compared to placebo. This is a small improvement. – The placebo group had an improvement in function of 10.51 points. – The antidepressant group had an improvement in function of 16.16 points. Quality of life Quality of life improved by 4% more with antidepressants compared to placebo. This was 0.04 points higher on a −0.11 to 1 scale in people taking antidepressants compared to placebo (higher score = better quality of life). – In the placebo group, quality of life improved by 0.07 points. – In the antidepressant group, quality of life improved by 0.11 points. Withdrawals due to side effects The risk of stopping treatment was 2.15 more in the antidepressant group compared to placebo. This means that 1 in 17 people stopped taking the antidepressant because of side effects. – 5.1% of the placebo group withdrew because of side effects. – 10.9% of the antidepressant group withdrew because of side effects. Total side effects The risk of having any side effects was 1.27 more in the antidepressant group compared to the placebo group. About 14.8% more people reported a side effect in the antidepressant group. This is equivalent to 1 in every 7 people having a side effect. – 49.3% of the placebo group had a side effect. – 64.1% of the antidepressant group had a side effect. Serious side effects There was no difference in serious side effects between groups. – 1.7% of the placebo group had serious side effects. – 1.6% of the antidepressant group had serious side effects. Quality of the evidence In people with osteoarthritis, high‐quality evidence shows that antidepressants have a small positive effect on pain and function and that one in six people have a clinically important response of a 50% or greater reduction in their pain. High‐quality evidence also demonstrates that people taking antidepressants have a higher frequency of side effects than those taking placebo. Moderate‐quality evidence shows very small, probably unimportant, improvements in quality of life for people taking antidepressants compared to placebo. People receiving antidepressants are more likely to stop them because of side effects than placebo. Low‐quality evidence shows little difference in serious side effects between antidepressants and placebo."
J1812,2020,Are low and middle-income countries prioritising high-value healthcare interventions?,"<b>Introduction</b>: Since resources are finite, investing in services that produce the highest health gain 'return on investment' is critical. We assessed the extent to which low and middle-income countries (LMIC) have included cost-saving interventions in their national strategic health plans.
<b>Methods</b>: We used the Tufts Medical Center Global Health Cost-Effectiveness Analysis Registry, an open-source database of English-language cost-per-disability-adjusted life year (DALY) studies, to identify analyses published in the last 10 years (2008-2017) of cost-saving health interventions in LMICs. To assess whether countries prioritised cost-saving interventions within their latest national health strategic plans, we identified 10 countries, all in sub-Saharan Africa, with the highest measures on the global burden of disease scale and reviewed their national health priority plans.
<b>Results</b>: We identified 392 studies (63%) targeting LMICs that reported 3315 cost-per-DALY ratios, of which 207 ratios (6%) represented interventions reported to be cost saving. Over half (53%) of these targeted sub-Saharan Africa. For the 10 countries we investigated in sub-Saharan Africa, 58% (79/137) of cost-saving interventions correspond with priorities identified in country plans. Alignment ranged from 95% (21/22 prioritised cost-saving ratios) in South Africa to 17% (2/12 prioritised cost-saving ratios) in Cameroon. Human papillomavirus vaccination was a noted priority in 70% (7/10) of national health prioritisation plans, while 40% (4/10) of countries explicitly included prenatal serological screening for syphilis. HIV prevention and treatment were stated priorities in most country health plans, whereas 40% (2/5) of countries principally outlined efforts for lymphatic filariasis. From our sample of 45 unique interventions, 36% of interventions (16/45) included costs associated directly with the implementation of the intervention.
<b>Conclusion</b>: Our findings indicate substantial variation across country and disease area in incorporating economic evidence into national health priority plans in a sample of sub-Saharan African countries. To make health economic data more salient, the authors of cost-effectiveness analyses must do more to reflect implementation costs and other factors that could limit healthcare delivery."
J2869,2021,A cost utility analysis of robotic versus open mitral valve repair in mitral valve regurgitation,"Objectives: For the first time this study carried out a cost-utility analysis comparing open surgical repair versus robotic minimally invasive surgical repair for Mitral Regurgitation. The respective benefits and costs of each treatment option gained from data in published literature have been analysed and subsequent suggestions for the allocation of resources and treatment recommendation will be offered. Method(s): The analysis was performed by including intraoperative and post-operative costs of the interventions and costs of the most prevalent complications associated with each operation. Thus, the Quality Adjusted Life Years (QALYs) calculated will guide the decision of resource allocation by assessing whether the added cost of robotic surgery is justified given the NICE (National institute of Clinical Excellence) threshold of 30,000/QALY. The choice of perspective taken is through the lens of the British National Healthcare System. Result(s): The Incremental cost-effectiveness ratio (ICER) calculated was 4781.44/QALY. This ICER shows that if robotic surgery was to become gold standard, the NHS would be paying 4781.44/QALY gained per patient. Considering robotic surgery is associated with fewer complications for patients but also has a cost per QALY below the NICE threshold of 30,000/QALY, it seems that this is a fitting alternative to open heart mitral valve repair. After a sensitivity analysis accounting for the initial robotic capital investment the ICER resulted to 22,379.94/QALY, still below NICE's threshold. Conclusion(s): Our results have shown that robotic assisted minimally invasive repair of the mitral valve is a cost-effective option and can be implemented in the British national healthcare setting."
J2085,2020,Estimating the population health and economic impacts of introducing a pneumococcal conjugate vaccine in Malaysia- an economic evaluation,"Pneumococcal disease is a potentially fatal bacterial infection that is vaccine-preventable. Malaysia has yet to adopt a pneumococcal conjugate vaccine (PCV) into its national immunization program (NIP). In 2016, pneumonia was the 3<sup>rd</sup> leading cause of death in children under five in Malaysia, accounting for 3.8% of under-five deaths. Introducing a pneumococcal conjugate vaccine (PCV) is an effective strategy to reduce the disease burden. This study used a decision-analytic model to assess the potential impacts of introducing the available PCVs (13-valent and 10-valent) in Malaysia. Epidemiological and costs inputs were sourced from published literature. For each vaccination program, health outcomes and associated healthcare costs were estimated. The scenarios of initiating PCV13 vs. PCV10 and the status quo (no pneumococcal vaccine) were compared. Serotype trends of Finland and the U.K. were used to model the clinical impacts of PCV10 and PCV13 respectively. The base-case analysis used a societal perspective over a 5-year time horizon. Compared with PCV10, PCV13 was projected to avert an additional 190,628 cases of pneumococcal disease and 1126 cases of death. The acquisition of PCV13 was estimated to cost an incremental US$89,904,777, offset by a cost reduction of -US$250,219,914 on pneumococcal disease-related medical care and lost productivity. PCV13 demonstrated a higher cost-saving potential over PCV10. Compared with no vaccination, PCV13 was estimated as cost-saving. Results were robust across a series of sensitivity analyses. The introduction of PCV13 in a NIP was estimated to reduce a significant burden of disease and to be a cost-saving for the Malaysian health system."
J5902,2025,Syrian refugee and diaspora healthcare professionals: Case studies from the eastern mediterranean and European regions,"Thousands of Syrian healthcare professionals have been forced to leave Syria since the onset of the uprisings in March 2011 and subsequent descent into conflict. Initially, many stayed in the eastern mediterranean region; however, as the conflict became increasingly protracted and employment policies for Healthcare Professionals (HCPs) became increasingly restrictive, some moved elsewhere, particularly to Germany and the United Kingdom, both of which have aimed to capitalise on both refugee and diaspora HCPs to support human resources gaps in their health systems. Our aim is to explore the different policy practices towards Syrian refugee and diaspora HCPs in the eastern mediterranean and European regions. Method(s): We completed a narrative literature review and held a closed, virtual workshop in November 2022 in which 45 participants, most of whom had lived experience in the different refugee hosting contexts, participated. This allowed us to probe the primary themes arising from the literature review and the authors' observations and present our findings as case studies. Result(s): We explore through case studies from countries near Syria (Turkey, Lebanon, Jordan, Egypt) and in Europe (Germany, UK) different policies which support or restrict entry into the health workforce. For host countries, those which implement policies that support retraining, accreditation and entry into the workforce have the potential for sustained and cost-effective benefit to their health systems; the impact of this on the HCPs and health system needs further exploration. Without such policies, Syrian HCPs are forced to work in the informal health sector such as in Lebanon or Egypt, leading to potential exploitation and security risks. Discussion(s): Now is an important opportunity to support Syrian and other refugee HCPs who have been forced to leave their homes to capitalise on their skills to explore the impacts of potentially effective policies and interventions. Such policies that aim to invest in refugee HCPs' skills, further develop their aptitudes, and potentially establish a connection between them and their homeland in a mutually beneficial manner for both health systems in exile and in their homeland. Nonetheless, this topic still has large research gaps and remains in need of urgent research and data, particularly in view of the fall of the Syrian regime in December 2024 and its potential impacts. Copyright © 2024"
J4885,2024,"Discontinuation of anti-tumour necrosis factor alpha treatment owing to blood test abnormalities, and cost-effectiveness of alternate blood monitoring strategies",
J3114,2022,Evaluating the impact of a digital leadership programme on national digital priorities: A mixed methods study,"Objectives This study aimed to determine the impact of the United Kingdom's National Health Service Digital Academy (NHSDA) Digital Health Leadership course on high-level recommendations in digital preparedness and the development of a proficient leadership to oversee digital transformation, which has been a longstanding priority within the NHS. Design A mixed methods study incorporating an online questionnaire, in-depth interviews and focus groups that were then analysed through a thematic analysis, underpinned by a constructivist approach. Settings An online mixed methods study of a defined cohort of participants who had completed the NHSDA course. Participants 26 participants were recruited to the study, of whom 50% were clinicians, 26.9% in management and 19.2% in data science. All had completed the 2-year NHSDA programme in Digital Health Leadership more than 6 months prior. Results Interviews and focus groups elicited two key areas of impact of the course: loco-regional digitisation and the development of a network of change agents. The dissertation project had direct effects on local digital transformation efforts. Most of these projects focused on clinician (11.7%) or service user (10.3%) engagement, as oppose to de novo digital processes (9.4%). The development of a network of digital leaders has facilitated communication between organisations and improved the efficiency of the national digital infrastructure. Conclusions A bespoke course incorporating a dissertation of practice model for digital health leaders can have broader impact for the attainment of digital priorities. This includes helping trusts to successfully adopt digital solutions, as well as fostering shared organisational learning. These influences, however, are mediated by resource and cultural barriers, which continue to hinder transformation efforts. Copyright © Author(s) (or their employer(s)) 2022."
J3116,2022,Communication of personalised disease risk by general practitioners to motivate smoking cessation in England: a cost-effectiveness and research prioritisation study,"BACKGROUND AND AIMS: Communication of personalised disease risk can motivate smoking cessation. We assessed whether routine implementation of this intervention by general practitioners (GPs) in England is cost-effective or whether we need further research to better establish its effectiveness. DESIGN: Cost-effectiveness analysis (CEA) with value of information (VoI) analysis from the UK National Health Service perspective, using GP communication of personalised disease risk on smoking cessation versus usual care. SETTING: GP practices in England. STUDY POPULATION: Healthy smokers aged 35-60 years attending the GP practice. MEASUREMENTS: Effectiveness of GP communication of personalised disease risk on smoking cessation was estimated through systematic review and meta-analysis. A Bayesian CEA was then performed using a lifetime Markov model on smokers aged 35-60 years that measured lifetime costs and quality-adjusted life-years (QALYs) assigned to the four diseases contributing the most to smoking-related morbidity, mortality and costs: chronic obstructive pulmonary disease, lung cancer, myocardial infarction and stroke. Costs and QALYs for each disease state were obtained from the literature. VoI analysis identified sources of uncertainty in the CEA and assessed how much would be worth investing in further research to reduce this uncertainty. FINDINGS: The meta-analysis odds ratio for the effectiveness estimate of GP communication of personalised disease risk was 1.48 (95% credibility interval, 0.91-2.26), an absolute increase in smoking cessation rates of 3.84%. The probability of cost-effectiveness ranged 89-94% depending on sex and age. VoI analysis indicated that: (i) uncertainty in the effectiveness of the intervention was the driver of the overall uncertainty in the CEA; and (ii) a research investment to reduce this uncertainty is justified if lower than 27.6 million (7 per smoker). CONCLUSION(S): Evidence to date shows that, in England, incorporating disease risk communication into general practitioners' practices to motivate smoking cessation is likely to be cost-effective compared with usual care. Copyright © 2021 Society for the Study of Addiction."
J3117,2022,EE7 Economic Evaluation of COVID-19 Vaccines: A Targeted Literature Review,"Objectives: The COVID-19 pandemic became a public health threat requiring the rapid development and distribution of vaccines around the world to help combat the virus. The objective of this study was to review and summarize published economic evaluations of COVID-19 vaccines with the aim of aiding the development of future models. Method(s): PubMed, Google Scholar, Cochrane Library, and other databases were searched from August 2021 to November 2021 to identify published literature of economic evaluations of COVID-19 vaccines. The studies identified were critically appraised and relevant data on the interventions and comparators, populations, perspectives, costs, utilities, time horizons, model structures, model types, and model outcomes from the included studies were extracted. Result(s): A total of 14 economic evaluations were identified through the targeted review including studies from the United States, Turkey, the United Kingdom, Taiwan, Spain, South Africa, Ukraine, and Denmark. Evaluation of the studies found that a 1-year time horizon was modeled in most studies. Analyses were mostly conducted from a healthcare payer perspective; however, in some studies, the societal perspective was included. Dynamic state transition (semi-Markov) models or decision tree models were utilized in the studies identified. A common structure of health states was observed with most models including the states: susceptible, infected, recovered, and dead. The infected state was often split into several sub-states to account for varying degrees of symptom severity. Across all the studies reviewed, COVID-19 vaccines were estimated to be a cost-effective use of public resources. Among the key drivers of the model outcomes identified in the studies were the cost of the vaccines, vaccine effectiveness, vaccine coverage, and time horizon used. Conclusion(s): This research aids future economic evaluations of COVID-19 vaccines by providing an overview of previously published models, including methodologies and parameter inputs used. Copyright © 2022"
